{"$defs":{"ArtifactRef":{"additionalProperties":false,"properties":{"artifact_id":{"maxLength":128,"minLength":1,"pattern":"[A-Za-z0-9][A-Za-z0-9._:/-]{0,127}","type":"string"},"digest":{"pattern":"sha256:[0-9a-f]{64}","type":"string"},"media_type":{"minLength":3,"pattern":"[A-Za-z0-9!#$&^_.+-]+/[A-Za-z0-9!#$&^_.+-]+(?:;[^\\r\\n]+)?","type":"string"},"role":{"maxLength":128,"minLength":1,"pattern":"[A-Za-z0-9][A-Za-z0-9._:/-]{0,127}","type":"string"},"schema_uri":{"anyOf":[{"type":"string"},{"type":"null"}],"minLength":1,"pattern":"[A-Za-z][A-Za-z0-9+.-]*:.+"},"size_bytes":{"maximum":16777216,"minimum":0,"type":"integer"},"uri":{"minLength":1,"pattern":"[A-Za-z][A-Za-z0-9+.-]*:.+","type":"string"}},"required":["artifact_id","role","uri","digest","size_bytes","media_type"],"type":"object"},"ContractVersion":{"additionalProperties":false,"properties":{"major":{"const":"1","type":"string"},"minor":{"const":"0","type":"string"},"schema_uri":{"const":"https://schemas.easy-cheese.dev/handoff-pointer","type":"string"}},"required":["schema_uri","major","minor"],"type":"object"},"HandoffPointer":{"additionalProperties":false,"properties":{"contract_version":{"$ref":"#/$defs/ContractVersion"},"destination_phase":{"maxLength":128,"minLength":1,"pattern":"[A-Za-z0-9][A-Za-z0-9._:/-]{0,127}","type":"string"},"normalization_receipt":{"anyOf":[{"$ref":"#/$defs/ArtifactRef"},{"type":"null"}]},"operation_id":{"maxLength":128,"minLength":1,"pattern":"[A-Za-z0-9][A-Za-z0-9._:/-]{0,127}","type":"string"},"payload":{"$ref":"#/$defs/ArtifactRef"},"request_digest":{"pattern":"sha256:[0-9a-f]{64}","type":"string"},"source_phase":{"maxLength":128,"minLength":1,"pattern":"[A-Za-z0-9][A-Za-z0-9._:/-]{0,127}","type":"string"}},"required":["contract_version","operation_id","request_digest","source_phase","destination_phase","payload"],"type":"object"}},"$id":"https://schemas.easy-cheese.dev/handoff-pointer","$ref":"#/$defs/HandoffPointer","$schema":"https://json-schema.org/draft/2020-12/schema","title":"HandoffPointer","x-maxContractBytes":8388608,"x-maxContractDepth":64}
